{
  "scenario_id": "manufacturing-signed-weak-evidence-v1",
  "identity_continuity": "VERIFIED",
  "package_integrity": "PASS",
  "claim_support": "INSUFFICIENT",
  "claim_truth": "NOT_DETERMINED",
  "fraud_assessment": "NOT_ESTABLISHED",
  "s3_status": "ABSENT",
  "evidence_assessment": [
    {
      "evidence_id": "evidence-s1-internal-800h",
      "s_class": "S1",
      "relevance": "DIRECT",
      "scope_match": "PARTIAL",
      "limitations": [
        "The test observed three organization-selected prototypes for 800 hours, not 10,000 hours.",
        "The raw observations and extrapolation model are not published."
      ]
    },
    {
      "evidence_id": "evidence-s2-material-dimensions",
      "s_class": "S2",
      "relevance": "IRRELEVANT",
      "scope_match": "MISMATCH",
      "limitations": [
        "The issuer-signed report covers dimensions and material composition only.",
        "It does not test operating life, durability, fatigue, or the declared operating conditions."
      ]
    }
  ],
  "missing_support": [
    "No evidence directly observes or validly models 10,000 hours under the declared conditions.",
    "No S3 random purchase or random sampling evidence is published."
  ],
  "risk_gaps": [
    "The organization selected the S1 prototypes.",
    "The S2 sample was supplied by the organization and its scope does not cover lifetime."
  ],
  "next_checks": [
    {
      "priority": 1,
      "target_gap": "EXTRAPOLATION_AND_RAW_OBSERVATIONS",
      "cost_level": "LOW",
      "action": "Request the S1 raw observations, failure and censoring treatment, and the model used to extrapolate 800 hours to 10,000 hours.",
      "reason": "This first tests whether the existing low-cost evidence has a defensible lifetime inference."
    },
    {
      "priority": 2,
      "target_gap": "DIRECT_LIFETIME_TEST_SCOPE",
      "cost_level": "MODERATE",
      "action": "Request a test or report whose declared scope covers operating life under the stated load, speed, temperature, lubrication, and failure criteria.",
      "reason": "The current S2 report is authentic but does not address the claim."
    },
    {
      "priority": 3,
      "target_gap": "SAMPLE_PRODUCT_BATCH_LINKAGE",
      "cost_level": "MODERATE",
      "action": "Establish sample-to-model and batch linkage, then seek independent or random sampling if buyer policy requires it.",
      "reason": "This reduces hand-picked sample risk without demanding unlimited testing."
    }
  ],
  "artifact_refs": [
    "claims/product-claims.json",
    "evidence/evidence-manifest.json",
    "evidence-s1-internal-800h",
    "evidence-s2-material-dimensions"
  ],
  "final_policy_decision": "EXTERNAL_REQUIRED",
  "summary": "The identity and signed package verify, but the published evidence does not sufficiently establish the 10,000-hour operating-life claim. This is an evidence gap, not proof that the claim is false or fraudulent."
}
