{
  "scenario_id": "manufacturing-signed-weak-evidence-v1",
  "identity_continuity": "VERIFIED",
  "package_integrity": "PASS",
  "claim_support": "INSUFFICIENT",
  "claim_truth": "NOT_DETERMINED",
  "fraud_assessment": "NOT_ESTABLISHED",
  "s3_status": "ABSENT",
  "evidence_assessment": [
    {
      "evidence_id": "evidence-s1-internal-800h",
      "s_class": "S1",
      "relevance": "DIRECT",
      "scope_match": "PARTIAL",
      "limitations": [
        "The test observed 800 hours rather than the claimed 10,000 hours.",
        "Only three organization-selected prototypes were tested.",
        "Raw observations, failure/censoring treatment, and the extrapolation model are not published."
      ]
    },
    {
      "evidence_id": "evidence-s2-material-dimensions",
      "s_class": "S2",
      "relevance": "INDIRECT",
      "scope_match": "MISMATCH",
      "limitations": [
        "The report covers dimensions and material composition, not operating life, durability, fatigue, or the declared operating conditions.",
        "The tested sample was organization supplied and selected.",
        "Issuer-backed identity does not extend the report's scope to the lifetime claim."
      ]
    }
  ],
  "missing_support": [
    "Direct lifetime evidence covering at least 10,000 hours under the declared load, speed, and ambient-temperature conditions.",
    "Published raw observations, test method, failure/censoring treatment, and a justified extrapolation model for the 800-hour test.",
    "Product, production-batch, and sample-chain linkage for the tested bearings."
  ],
  "risk_gaps": [
    "The claimed life is extrapolated more than twelvefold beyond the disclosed observation period.",
    "Three organization-selected prototypes do not address representativeness or hand-picked-sample risk.",
    "No S3 random-purchase or random-sampling evidence is present.",
    "The third-party report is explicitly out of scope for lifetime performance."
  ],
  "next_checks": [
    {
      "priority": 1,
      "target_gap": "EXTRAPOLATION_AND_RAW_OBSERVATIONS",
      "cost_level": "LOW",
      "action": "Request the existing 800-hour test's raw observations, protocol, environmental controls, failure and censoring treatment, and the documented extrapolation model with its assumptions.",
      "reason": "These existing records are the lowest-cost way to determine whether the stated extrapolation has a defensible basis."
    },
    {
      "priority": 2,
      "target_gap": "SAMPLE_PRODUCT_BATCH_LINKAGE",
      "cost_level": "LOW",
      "action": "Request serial or lot identifiers, manufacturing and inspection records, and custody linkage for each prototype and for the product offered for purchase.",
      "reason": "This establishes whether the tested prototypes represent the claimed product and production batch."
    },
    {
      "priority": 3,
      "target_gap": "INDEPENDENT_OR_RANDOM_SAMPLE",
      "cost_level": "MODERATE",
      "action": "Obtain independent or random-market samples from identified production lots and have a qualified laboratory conduct or witness lifecycle testing at the declared conditions.",
      "reason": "Independent sampling reduces organization-selected-sample risk and can provide direct support for the claimed operating life."
    }
  ],
  "artifact_refs": [
    "verify/claims/product-claims.json",
    "verify/evidence/evidence-manifest.json",
    "evidence-s1-internal-800h",
    "verify/evidence-artifacts/s1-internal-800h-test.json",
    "evidence-s2-material-dimensions",
    "verify/evidence-artifacts/s2-material-dimensions-report.json"
  ],
  "final_policy_decision": "EXTERNAL_REQUIRED",
  "summary": "The signed package and identity continuity verify, but they do not establish the product claim. The only direct evidence is a first-party, organization-selected three-prototype test lasting 800 hours, with no raw observations or published extrapolation model; the issuer-backed report expressly does not assess operating life. The claim is therefore insufficiently supported, its truth is not determined, and no fraud is established."
}
