{
  "scenario_id": "manufacturing-signed-weak-evidence-v1",
  "identity_continuity": "VERIFIED",
  "package_integrity": "PASS",
  "claim_support": "INSUFFICIENT",
  "claim_truth": "NOT_DETERMINED",
  "fraud_assessment": "NOT_ESTABLISHED",
  "s3_status": "ABSENT",
  "evidence_assessment": [
    {
      "evidence_id": "evidence-s1-internal-800h",
      "s_class": "S1",
      "relevance": "DIRECT",
      "scope_match": "PARTIAL",
      "limitations": [
        "First-party internal test with three organization-selected prototypes",
        "Observed for 800 hours rather than 10,000 hours",
        "Raw observations, censoring/failure treatment, and extrapolation model are not published",
        "The extrapolation to at least 10,000 hours is an organization inference"
      ]
    },
    {
      "evidence_id": "evidence-s2-material-dimensions",
      "s_class": "S2",
      "relevance": "INDIRECT",
      "scope_match": "PARTIAL",
      "limitations": [
        "Third-party report covers dimensions and material composition only",
        "It does not test operating life, durability, fatigue, or the declared operating conditions",
        "Sample was organization-submitted",
        "Issuer backing remains a manual check in the verifier"
      ]
    }
  ],
  "missing_support": [
    "A direct lifetime demonstration or validated analysis supporting at least 10,000 hours",
    "Published raw observations, failure/censoring treatment, and a justified extrapolation model",
    "Independent or random-sample evidence linked to the product batch or units covered by the claim"
  ],
  "risk_gaps": [
    "The 10,000-hour claim is extrapolated from only 800 observed hours",
    "All tested prototypes were organization-selected, with no S3 random purchase or sampling evidence",
    "The raw data and extrapolation method are unavailable for review",
    "The third-party evidence is out of scope for lifetime performance",
    "The verifier reports a manual subject-coverage check for product versus product_model"
  ],
  "next_checks": [
    {
      "priority": 1,
      "target_gap": "EXTRAPOLATION_AND_RAW_OBSERVATIONS",
      "cost_level": "LOW",
      "action": "Request the 800-hour raw observations, test method, failure and censoring treatment, and the complete extrapolation calculation.",
      "reason": "This is the lowest-cost way to assess whether the existing result can reasonably support the claimed lifetime."
    },
    {
      "priority": 2,
      "target_gap": "SAMPLE_PRODUCT_BATCH_LINKAGE",
      "cost_level": "LOW",
      "action": "Request serial, lot, or batch identifiers and manufacturing records linking the three tested prototypes to the commercial NMC-NA4908 product scope.",
      "reason": "The evidence must be shown to represent the product and production scope to which the claim applies."
    },
    {
      "priority": 3,
      "target_gap": "INDEPENDENT_OR_RANDOM_SAMPLE",
      "cost_level": "MODERATE",
      "action": "Obtain independently selected or randomly purchased NMC-NA4908 samples with documented custody and repeat the relevant test or review.",
      "reason": "This reduces the risk that organization-selected prototypes do not represent ordinary production."
    },
    {
      "priority": 4,
      "target_gap": "DIRECT_LIFETIME_TEST_SCOPE",
      "cost_level": "HIGH",
      "action": "Commission an independent, statistically justified lifetime or endurance test covering 2.5 kN radial load, 1,500 rpm, and maximum 60 C ambient temperature for the claimed duration or a validated equivalent.",
      "reason": "Direct scoped testing is needed if the existing data cannot justify the 10,000-hour extrapolation."
    }
  ],
  "artifact_refs": [
    "claims/product-claims.json",
    "evidence/evidence-manifest.json",
    "evidence-s1-internal-800h",
    "evidence-artifacts/s1-internal-800h-test.json",
    "evidence-s2-material-dimensions",
    "evidence-artifacts/s2-material-dimensions-report.json"
  ],
  "final_policy_decision": "EXTERNAL_REQUIRED",
  "summary": "Identity and package integrity verify successfully, but the claim is insufficiently supported: the only direct life evidence is a first-party 800-hour test of selected prototypes extrapolated to 10,000 hours without raw data or a published model, while the third-party report does not test lifetime. The claim is not established as true or false, and fraud is not established."
}
